{
  "briefId": "clr2brief0001example001",
  "briefRevision": 3,
  "platforms": ["wechat", "xiaohongshu"],
  "templateId": "clr2template0001example01",
  "brandVoiceId": "clr2voice00001example001",
  "usageOperationId": "content-workflow:ws_6b0c2d4e5f:5f2a9c3b8e1d40a7b6c5d2e3f4a5b6c7d8e9f0a1b2c3d4e5f6a7b8c9d0e1f2a3"
}
